{
  "schema_name": "epi_runtime_state_schedule",
  "schema_version": "1.0.0",
  "profile_id": "l5_l6_x_runtime_state_schedule",
  "scenarios": [
    {
      "scenario_id": "L5-1_v1",
      "initial_entity_states": {
        "uav_weather_l5_1_v1": {
          "mission_state": {
            "unsafe": false
          },
          "navigation_state": {
            "route_degraded": false
          },
          "control_state": {
            "slowdown_active": false
          }
        }
      },
      "event_state_transitions": {
        "rain_speed_reduction": [
          {
            "entity_id": "uav_weather_l5_1_v1",
            "delay_ticks": 1,
            "state_patch": {
              "control_state": {
                "slowdown_active": true
              }
            }
          }
        ],
        "rain_intensifies": [
          {
            "entity_id": "uav_weather_l5_1_v1",
            "delay_ticks": 1,
            "state_patch": {
              "navigation_state": {
                "route_degraded": true
              },
              "mission_state": {
                "unsafe": true
              }
            }
          }
        ],
        "rain_recovery": [
          {
            "entity_id": "uav_weather_l5_1_v1",
            "delay_ticks": 5,
            "state_patch": {
              "control_state": {
                "slowdown_active": false
              },
              "navigation_state": {
                "route_degraded": false
              },
              "mission_state": {
                "unsafe": false
              }
            }
          }
        ]
      }
    },
    {
      "scenario_id": "L5-1_v2",
      "initial_entity_states": {
        "uav_weather_l5_1_v2": {
          "mission_state": {
            "unsafe": false
          },
          "navigation_state": {
            "route_degraded": false
          },
          "control_state": {
            "slowdown_active": false
          }
        }
      },
      "event_state_transitions": {
        "rain_speed_reduction": [
          {
            "entity_id": "uav_weather_l5_1_v2",
            "delay_ticks": 1,
            "state_patch": {
              "control_state": {
                "slowdown_active": true
              }
            }
          }
        ],
        "rain_low_visibility_reroute": [
          {
            "entity_id": "uav_weather_l5_1_v2",
            "delay_ticks": 1,
            "state_patch": {
              "navigation_state": {
                "route_degraded": true
              },
              "mission_state": {
                "unsafe": true
              }
            }
          }
        ],
        "rain_partial_recovery": [
          {
            "entity_id": "uav_weather_l5_1_v2",
            "delay_ticks": 5,
            "state_patch": {
              "control_state": {
                "slowdown_active": false
              },
              "navigation_state": {
                "route_degraded": false
              },
              "mission_state": {
                "unsafe": false
              }
            }
          }
        ]
      }
    },
    {
      "scenario_id": "L5-1_v3",
      "initial_entity_states": {
        "uav_weather_l5_1_v3": {
          "mission_state": {
            "unsafe": false
          },
          "control_state": {
            "rth_active": false
          }
        }
      },
      "event_state_transitions": {
        "heavy_rain_termination": [
          {
            "entity_id": "uav_weather_l5_1_v3",
            "delay_ticks": 1,
            "state_patch": {
              "mission_state": {
                "unsafe": true
              }
            }
          }
        ],
        "rain_landing_confirmed": [
          {
            "entity_id": "uav_weather_l5_1_v3",
            "delay_ticks": 1,
            "state_patch": {
              "mission_state": {
                "unsafe": false
              }
            }
          }
        ]
      }
    },
    {
      "scenario_id": "L5-2_v1",
      "initial_entity_states": {
        "uav_weather_l5_2_v1": {
          "mission_state": {
            "unsafe": false,
            "mission_abort_active": false
          },
          "navigation_state": {
            "visual_navigation_degraded": false,
            "visual_navigation_failed": false
          }
        }
      },
      "event_state_transitions": {
        "visual_navigation_failure": [
          {
            "entity_id": "uav_weather_l5_2_v1",
            "delay_ticks": 1,
            "state_patch": {
              "navigation_state": {
                "visual_navigation_degraded": true
              }
            }
          },
          {
            "entity_id": "uav_weather_l5_2_v1",
            "delay_ticks": 5,
            "state_patch": {
              "navigation_state": {
                "visual_navigation_failed": true
              },
              "mission_state": {
                "unsafe": true
              }
            }
          }
        ],
        "fog_mission_abort": [
          {
            "entity_id": "uav_weather_l5_2_v1",
            "delay_ticks": 1,
            "state_patch": {
              "mission_state": {
                "mission_abort_active": true
              }
            }
          }
        ]
      }
    },
    {
      "scenario_id": "L5-2_v2",
      "initial_entity_states": {
        "uav_weather_l5_2_v2": {
          "mission_state": {
            "unsafe": false,
            "mission_abort_active": false
          },
          "navigation_state": {
            "visual_navigation_degraded": false,
            "visual_navigation_failed": false,
            "visual_navigation_recovered": false
          }
        }
      },
      "event_state_transitions": {
        "visual_navigation_failure": [
          {
            "entity_id": "uav_weather_l5_2_v2",
            "delay_ticks": 1,
            "state_patch": {
              "navigation_state": {
                "visual_navigation_degraded": true
              }
            }
          },
          {
            "entity_id": "uav_weather_l5_2_v2",
            "delay_ticks": 5,
            "state_patch": {
              "navigation_state": {
                "visual_navigation_failed": true
              },
              "mission_state": {
                "unsafe": true
              }
            }
          }
        ],
        "fog_mission_abort": [
          {
            "entity_id": "uav_weather_l5_2_v2",
            "delay_ticks": 1,
            "state_patch": {
              "mission_state": {
                "mission_abort_active": true
              }
            }
          }
        ],
        "fog_landing_confirmed": [
          {
            "entity_id": "uav_weather_l5_2_v2",
            "delay_ticks": 1,
            "state_patch": {
              "mission_state": {
                "unsafe": false
              }
            }
          }
        ]
      }
    },
    {
      "scenario_id": "L5-3_v1",
      "initial_entity_states": {},
      "event_state_transitions": {}
    },
    {
      "scenario_id": "L5-3_v2",
      "initial_entity_states": {
        "uav_weather_l5_3_v2": {
          "mission_state": {
            "termination_active": false
          }
        }
      },
      "event_state_transitions": {
        "wind_gust_intensifies": [
          {
            "entity_id": "uav_weather_l5_3_v2",
            "delay_ticks": 5,
            "state_patch": {
              "mission_state": {
                "termination_active": true
              }
            }
          }
        ]
      }
    },
    {
      "scenario_id": "L5-4_v1",
      "initial_entity_states": {
        "uav_weather_l5_4_v1": {
          "sensor_state": {
            "image_underexposed": false,
            "infrared_mode_active": false,
            "exposure_recovered": false
          }
        }
      },
      "event_state_transitions": {
        "dusk_light_shift": [
          {
            "entity_id": "uav_weather_l5_4_v1",
            "delay_ticks": 1,
            "state_patch": {
              "sensor_state": {
                "image_underexposed": true
              }
            }
          }
        ],
        "infrared_switch": [
          {
            "entity_id": "uav_weather_l5_4_v1",
            "delay_ticks": 1,
            "state_patch": {
              "sensor_state": {
                "infrared_mode_active": true
              }
            }
          }
        ],
        "low_light_termination": [
          {
            "entity_id": "uav_weather_l5_4_v1",
            "delay_ticks": 5,
            "state_patch": {
              "sensor_state": {
                "image_underexposed": false,
                "infrared_mode_active": false,
                "exposure_recovered": true
              }
            }
          }
        ]
      }
    },
    {
      "scenario_id": "L5-5_v1",
      "initial_entity_states": {
        "uav_weather_l5_5_v1": {
          "mission_state": {
            "mission_abort_active": false
          }
        }
      },
      "event_state_transitions": {
        "thermal_abort": [
          {
            "entity_id": "uav_weather_l5_5_v1",
            "delay_ticks": 1,
            "state_patch": {
              "mission_state": {
                "mission_abort_active": true
              }
            }
          }
        ]
      }
    },
    {
      "scenario_id": "L6-1_v1",
      "initial_entity_states": {
        "uav_digital_l6_1_v1": {
          "communication_state": {
            "communication_unavailable": false
          },
          "control_state": {
            "rth_active": false
          }
        }
      },
      "event_state_transitions": {
        "c2_loss": [
          {
            "entity_id": "uav_digital_l6_1_v1",
            "delay_ticks": 1,
            "state_patch": {
              "communication_state": {
                "communication_unavailable": true
              }